{
  "$schema": "http://json-schema.org/draft-07/schema#",
  "$id": "https://logweir.dev/schemas/logweir-backup-receipt-1.0.0.json",
  "title": "BackupReceipt",
  "description": "The signed record of one `logweir backup run`.\n\nField order is the document's own serialisation order (`serde_json` is built with `preserve_order`, so declaration order IS byte order through `crate::det_json::to_deterministic_json`). Do not reorder without regenerating `schemas/logweir-backup-receipt-1.0.0.json` and re-minting `e2e/fixtures/signed/backup-receipt.json`.",
  "type": "object",
  "required": [
    "archive",
    "backup_id",
    "covered",
    "engine",
    "exit_code",
    "finished_at",
    "format_version",
    "records",
    "requested_at",
    "run_id",
    "source",
    "started_at",
    "triggered_by"
  ],
  "properties": {
    "archive": {
      "$ref": "#/definitions/ReceiptArchive"
    },
    "backup_id": {
      "description": "The engine's own identifier for the archive this run wrote. Distinct from `run_id`: two runs can be asked to append to one backup set, and `archive.manifest_key` is keyed on THIS.",
      "type": "string"
    },
    "covered": {
      "$ref": "#/definitions/ReceiptCovered"
    },
    "engine": {
      "$ref": "#/definitions/ReceiptEngine"
    },
    "exit_code": {
      "description": "The engine's exit status, as `crate::engine::BackupFacts` measured it — NOT the `logweir` process's own exit code, which maps through Global Constraint 11. Invariant 2 below is the biconditional that makes this field mean something: a receipt for a failed backup names no manifest.",
      "type": "integer",
      "format": "int32"
    },
    "finished_at": {
      "description": "When the engine subprocess finished.",
      "type": "string",
      "format": "date-time"
    },
    "format_version": {
      "description": "Semver of THIS format — `1.0.0`, or `1.1.0` for a receipt that pins `archive.manifest_version_id` (FX-7) — and independent of the scorecard's.\n\nThe schema PINS the major with a pattern rather than leaving the field an unconstrained string, for the reason `crate::scorecard::Scorecard::format_version` records: without it a document reading `\"9.9.9\"` validated cleanly against the file named `logweir-backup-receipt-1.0.0.json`, so a schema-only validator — the one route that does not go through `validate_invariants` — accepted exactly the document GC12 exists to refuse. Any `1.x.y` is allowed, because a MINOR bump adds optional fields only and a 1.0.0 reader must still read it.",
      "type": "string",
      "pattern": "^1\\.[0-9]+\\.[0-9]+$"
    },
    "records": {
      "description": "Records captured, per topic. Invariant 3 requires exactly one entry per `source.topics` entry and no others: a receipt that counts a topic the run was never asked to back up, or omits one it was, is describing some other run.\n\nA `BTreeMap`, so the key order is the topic names' own order and two runs over the same topic set produce byte-identical bytes here.",
      "type": "object",
      "additionalProperties": {
        "type": "integer",
        "format": "uint64",
        "minimum": 0.0
      }
    },
    "requested_at": {
      "description": "When the run was requested — the same clock reading `Scorecard::requested_at` carries.",
      "type": "string",
      "format": "date-time"
    },
    "run_id": {
      "description": "ULID of the run that produced this receipt. Also the object key stem in the evidence bucket, exactly as `Scorecard::run_id` is.",
      "type": "string"
    },
    "source": {
      "$ref": "#/definitions/ReceiptSource"
    },
    "started_at": {
      "description": "When the engine subprocess started. Logweir-measured, never engine-reported (`crate::engine::BackupFacts`): `backup` has no `--format` and writes no report file.",
      "type": "string",
      "format": "date-time"
    },
    "triggered_by": {
      "description": "Free text from `--triggered-by`. Deliberately **not** a metric label: unbounded cardinality, for the reason `Scorecard::triggered_by` records.",
      "type": "string"
    }
  },
  "definitions": {
    "ReceiptArchive": {
      "description": "What was written, and where. The two fields an auditor needs in order to go and look: the manifest's key, and a digest over the exact manifest bytes THIS RUN READ BACK (not over bytes Logweir remembers writing) — and, on a versioned bucket, WHICH VERSION of that key those bytes were.",
      "type": "object",
      "required": [
        "manifest_key",
        "manifest_sha256",
        "prefix"
      ],
      "properties": {
        "manifest_key": {
          "description": "Empty **if and only if** the backup did not exit 0 — invariant 2.",
          "type": "string"
        },
        "manifest_sha256": {
          "description": "`\"sha256:<hex>\"` over the manifest bytes read back after the run.",
          "type": "string"
        },
        "manifest_version_id": {
          "description": "**FX-7, format `1.1.0`.** The object store's VERSION id for the manifest bytes this run read back — present only when the store answered that read with one, i.e. on a bucket with versioning enabled.\n\n**ABSENT means \"no version was pinned\"**: an unversioned bucket (whose objects carry no version id, or S3's literal `null`, which names an object an overwrite replaces in place), or a receipt written before this field existed. Never read as \"version zero\" and never inferred.\n\nA reader that finds it compares the key's CURRENT version with it: a different current version means the backup set was written again after this receipt was signed, which the manifest digest alone cannot see — engine 0.21.0 rewrites a set's segments in place and can leave the manifest bytes identical. And it can read THIS version by id, which a versioned bucket retains whatever the current one is.\n\nAbsent when `None`, and that is the compatibility argument: declaration order is byte order, and an absent field writes nothing, so a receipt without a pin is byte-for-byte the `1.0.0` document it always was.",
          "type": "string",
          "nullable": true
        },
        "prefix": {
          "description": "The object-store prefix everything this run wrote lives under. GC6: Logweir writes only under its own `logweir/` prefix.",
          "type": "string"
        }
      }
    },
    "ReceiptAuth": {
      "description": "How the source client was told to authenticate. **Never a password, and no field that could hold one** — the render-side twin of `crate::engine::AuthRender`, whose doc comment states the same rule for the same reason: the secret reaches the engine through its own `${VAR}` environment expansion and is never interpolated by us, so it can never be interpolated into a document we then sign and publish.",
      "type": "object",
      "required": [
        "mode"
      ],
      "properties": {
        "mode": {
          "description": "**A CLOSED SET OF TWO: `\"plaintext\"` or `\"scramSha512\"`.** Any other value is refused by BOTH readers (arm 5 below, and `docs/verify_scorecard.py::check_backup_receipt_invariants`'s mirror), so a receipt naming a third spelling is never signed and never verifies.\n\nThese are `logweir_core::spec::AuthSpec`'s serde tag values, which is what makes ONE spelling possible at all: they are the strings an adopter writes in a spec, `KafkaCluster.spec.auth.mode`'s CRD enum byte for byte, the only two values `AuthSpec::mode_str()` can return, and — since Task 17 copies this field — what `Backup.status.auth.mode`'s CRD description promises. A `String` and not an enum on the wire because a reader must be able to REPORT a value it refuses; the closed set is enforced by the arm, where both readers can state it in the same words.",
          "type": "string"
        },
        "username": {
          "description": "The SASL username, when there is one. `null` under `plaintext` — which is not the same as an empty username.",
          "default": null,
          "type": "string",
          "nullable": true
        }
      }
    },
    "ReceiptCovered": {
      "description": "The time range the archive covers, in **EPOCH MILLISECONDS**, as a HALF-OPEN interval: `from_ms` is inclusive, `to_ms` is EXCLUSIVE.\n\n# The end is exclusive, and both documents now say so (I22)\n\n`config/crd/backups.yaml` documents `Backup.status.windowCovered.toMs` as the exclusive end, and Task 17 copies these two numbers into it. Task 5 shipped invariant 4 as `<=` — accepting `from_ms == to_ms` as an \"instantaneous window\" — which made the receipt and the CRD two descriptions of one range under rules that disagreed. Invariant 4 is now strict, and `crates/logweir/src/backup/phase_run.rs` converts the manifest's inclusive newest `end_timestamp` to an exclusive bound in the one place that measures it.\n\n# Not RFC 3339, and this is the interface, not a preference (I22)\n\n`Backup.status.windowCovered{fromMs,toMs}` mirrors this shape as two `int64`s, and a Kubernetes status subresource has no date-time type to mirror a string into. Two representations of one window — a string here and an integer there — would need a conversion nobody owns, and the first disagreement between them would be invisible: both would still be well-formed. So the receipt speaks the operator's units, and the operator copies the numbers.",
      "type": "object",
      "required": [
        "from_ms",
        "to_ms"
      ],
      "properties": {
        "from_ms": {
          "type": "integer",
          "format": "int64"
        },
        "to_ms": {
          "type": "integer",
          "format": "int64"
        }
      }
    },
    "ReceiptEngine": {
      "description": "The pinned engine that took the backup. `digest` is why this block is worth signing: GC7 pins by digest and never by tag, and a receipt that named only a version would be satisfied by any binary claiming it.",
      "type": "object",
      "required": [
        "digest",
        "id",
        "version"
      ],
      "properties": {
        "digest": {
          "description": "`\"sha256:…\"`, from `third_party/kafka-backup-binary.digest`.",
          "type": "string"
        },
        "id": {
          "description": "`\"oso-cli\"`.",
          "type": "string"
        },
        "version": {
          "description": "`\"v0.21.0\"` — at or above the GC8 floor.",
          "type": "string"
        }
      }
    },
    "ReceiptSource": {
      "description": "The SOURCE cluster, as measured — never as a spec claimed it.",
      "type": "object",
      "required": [
        "auth",
        "bootstrap_servers",
        "cluster_id",
        "topics"
      ],
      "properties": {
        "auth": {
          "$ref": "#/definitions/ReceiptAuth"
        },
        "bootstrap_servers": {
          "type": "array",
          "items": {
            "type": "string"
          }
        },
        "cluster_id": {
          "description": "Read from the broker at phase −1, never from the spec. GC18(c)'s fourth rail records the source `cluster_id` and re-asserts it is not the restore target; this is where the recorded value is attested.",
          "type": "string"
        },
        "topics": {
          "description": "The named topic allowlist the run was given. GC18(c) rail 1: a named set with no glob metacharacter (**G-GLOB**), so this list is the exact set of topics, not a pattern that a reader would have to re-expand against a cluster it cannot see.",
          "type": "array",
          "items": {
            "type": "string"
          }
        }
      }
    }
  }
}
